{
  "generated_at": "2026-04-07T11:43:37.2228492-05:00",
  "queue_state": {
    "status": "EMPTY_BY_DESIGN",
    "ready_items": [],
    "no_successor_item_reason": "No authoritative roadmap-derived follow-on is currently selected beyond the bounded Q-06-012 governance hardening slice."
  },
  "last_completed": {
    "queue_id": "Q-06-012",
    "label": "Checkpoint integrity + governance evidence binding",
    "title": "Checkpoint integrity and governance evidence binding"
  },
  "next_action": null,
  "validation_state": {
    "status": "PASSED",
    "synchronized_with_working_tree": true
  },
  "decision_record_refs": [
    {
      "id": "DR-040",
      "transition": "Q-06-011 READY -> COMPLETE",
      "evidence_references": [
        "EXECUTION_QUEUE.md#Q-06-011",
        "plans/2026-04-07-q-06-011-lock-track-c-provenance-note-overwrite-semantics.md#CLOSEOUT",
        "plans/2026-04-01-mvp-narrowing-and-contract-hardening.md#CLOSEOUT",
        "reports/exports/execution_queue.export.json",
        "reports/exports/checkpoint_closeout.export.json"
      ]
    },
    {
      "id": "DR-041",
      "transition": "QUEUE STATE READY -> EMPTY BY DESIGN",
      "evidence_references": [
        "EXECUTION_QUEUE.md#CURRENT-QUEUE-STATE",
        "EXECUTION_QUEUE.md#QUEUE-RE-ENTRY-RULES",
        "reports/exports/execution_queue.export.json",
        "reports/exports/checkpoint_closeout.export.json"
      ]
    },
    {
      "id": "DR-042",
      "transition": "SUCCESSOR ITEM CREATED -> NONE",
      "evidence_references": [
        "IMPLEMENTATION_PLAN.md",
        "plans/2026-04-01-mvp-narrowing-and-contract-hardening.md#CLOSEOUT",
        "plans/2026-04-07-q-06-012-checkpoint-integrity-and-governance-evidence-binding.md#CLOSEOUT",
        "EXECUTION_QUEUE.md#CURRENT-QUEUE-STATE",
        "reports/exports/checkpoint_closeout.export.json"
      ]
    }
  ],
  "evidence_refs": {
    "queue_markdown": {
      "path": "EXECUTION_QUEUE.md",
      "sha256": "sha256:488c6a8401accfeecf5ede0e6ef0c6fb0237853baaa76fd43b17aa4c60cce29a"
    },
    "queue_export": {
      "path": "reports/exports/execution_queue.export.json",
      "generated_at": "2026-04-07T11:43:37.2228492-05:00",
      "sha256": "sha256:8981a8d4f804a4b77c1ba3bfd9b7ea6d3f41adc61465d3f67f252894272ae0d4"
    },
    "relevant_plan_closeouts": [
      {
        "path": "plans/2026-04-01-mvp-narrowing-and-contract-hardening.md",
        "section": "CLOSEOUT",
        "sha256": "sha256:156cd91b97908a595c123f6203d30fb7aad38bd78bea68f82eaa5d218d18f73a"
      },
      {
        "path": "plans/2026-04-07-q-06-011-lock-track-c-provenance-note-overwrite-semantics.md",
        "section": "CLOSEOUT",
        "sha256": "sha256:5be48720c68ef4049fa1195fb3eeacaa66185817b857adba7ade9a15cd59d525"
      },
      {
        "path": "plans/2026-04-07-q-06-012-checkpoint-integrity-and-governance-evidence-binding.md",
        "section": "CLOSEOUT",
        "sha256": "sha256:c32e57b6571b7dc36a306642a2284f595bc3ecbbdf96c1e644cb71f0ae878854"
      }
    ],
    "validation_outputs": [
      {
        "command": "python scripts/build_execution_queue.py --mode check",
        "status": "passed"
      },
      {
        "command": "python scripts/validate_repo_contracts.py --mode validate",
        "status": "passed"
      },
      {
        "command": "python scripts/validate_repo_contracts.py --mode test",
        "status": "passed"
      },
      {
        "command": "python scripts/run_repo_validation.py",
        "status": "passed"
      }
    ],
    "schema_or_contract_surfaces": [
      {
        "path": "EXECUTION_QUEUE.md",
        "sha256": "sha256:488c6a8401accfeecf5ede0e6ef0c6fb0237853baaa76fd43b17aa4c60cce29a"
      },
      {
        "path": "DECISION_REGISTER.md",
        "sha256": "sha256:b510ecda404c5360e58e54117cb7ed664e876428e26cdc543fff0de3c57bface"
      },
      {
        "path": "schemas/execution_queue.schema.json",
        "sha256": "sha256:94f7d1bd6c1ecfd14dcca7d9f53c5df4673c781af46281bad9204677974056a4"
      },
      {
        "path": "schemas/decision_register.schema.json",
        "sha256": "sha256:a9858eefa524ee9911212b362e3cb1fcbe8a78d48105d2ceb0c36214a44cbeaa"
      },
      {
        "path": "schemas/checkpoint_closeout.schema.json",
        "sha256": "sha256:72614635b7721e0465aae96f450ebe3d1990d340c000242349ecef310334c678"
      },
      {
        "path": "VALIDATION.md",
        "sha256": "sha256:e344d9ce206cbdc20d4f706cc516d15b0f4a4a6527585cadf0ce08c94bdbd6f7"
      },
      {
        "path": "VALIDATION_STRATEGY.md",
        "sha256": "sha256:07c0ab4d56e7a0d7c731e809d2ba1a193296927379cdcd29b593c793b2b49df2"
      },
      {
        "path": "scripts/build_execution_queue.py",
        "sha256": "sha256:4cc65dd47011c96beba7e5c60d8ae82cb51bad5d03a1f39fb24c87a20e5fe257"
      },
      {
        "path": "scripts/validate_repo_contracts.py",
        "sha256": "sha256:cad136577608d52650f313ca3caced4f70f63413a0ad7851d0604b85b69631fb"
      }
    ]
  },
  "validation_context": {
    "queue_snapshot": "2026-04-07T11:43:37.2228492-05:00",
    "head_commit_hash": "6b79ba2f2f787717c2aae558778d3b07aaabfeb1",
    "commit_hash_basis": "baseline_parent",
    "working_tree_dirty": false,
    "working_tree_status": [],
    "validation_commands": [
      "python scripts/build_execution_queue.py --mode check",
      "python scripts/validate_repo_contracts.py --mode validate",
      "python scripts/validate_repo_contracts.py --mode test",
      "python scripts/run_repo_validation.py"
    ],
    "schema_versions": [
      {
        "path": "schemas/execution_queue.schema.json",
        "declared_version": null,
        "sha256": "sha256:94f7d1bd6c1ecfd14dcca7d9f53c5df4673c781af46281bad9204677974056a4"
      },
      {
        "path": "schemas/decision_register.schema.json",
        "declared_version": null,
        "sha256": "sha256:a9858eefa524ee9911212b362e3cb1fcbe8a78d48105d2ceb0c36214a44cbeaa"
      },
      {
        "path": "schemas/checkpoint_closeout.schema.json",
        "declared_version": null,
        "sha256": "sha256:72614635b7721e0465aae96f450ebe3d1990d340c000242349ecef310334c678"
      }
    ],
    "exported_artifacts": [
      {
        "path": "reports/exports/execution_queue.export.json",
        "generated_at": "2026-04-07T11:43:37.2228492-05:00",
        "sha256": "sha256:8981a8d4f804a4b77c1ba3bfd9b7ea6d3f41adc61465d3f67f252894272ae0d4"
      },
      {
        "path": "reports/exports/decision_register.export.json",
        "generated_at": null,
        "sha256": "sha256:5828ec19c9c2f7c19224d26c0afc2a6141c41e27729da2f083b8157bbb129f20"
      }
    ]
  },
  "superseded_dirty_checkpoint": {
    "generated_at": "2026-04-07T11:43:37.2228492-05:00",
    "artifact_sha256": "sha256:bd7a355427b8f9650c4a73a72fddb223baffcd7824b47d3b7a2402fd74b1a8f7",
    "head_commit_hash": "6b79ba2f2f787717c2aae558778d3b07aaabfeb1",
    "commit_hash_basis": "current_head",
    "working_tree_dirty": true,
    "working_tree_status": [
      "M BENCHMARK_STRATEGY.md",
      "M DECISION_REGISTER.md",
      "M EXECUTION_QUEUE.md",
      "M VALIDATION.md",
      "M VALIDATION_STRATEGY.md",
      "M benchmarks/README.md",
      "M benchmarks/tracks.md",
      "M plans/2026-04-01-mvp-narrowing-and-contract-hardening.md",
      "M plans/2026-04-06-q-06-009-lock-track-c-provenance-note-format.md",
      "M plans/2026-04-06-q-06-010-lock-track-c-provenance-note-location.md",
      "M plans/2026-04-07-repo-maintainability-and-validation-rebalance.md",
      "M reports/README.md",
      "M reports/exports/decision_register.export.json",
      "M reports/exports/execution_queue.export.json",
      "M schemas/decision_register.schema.json",
      "M schemas/execution_queue.schema.json",
      "M scir/contract_docs.py",
      "M scripts/NOT_ACTIVE.md",
      "M scripts/benchmark_contract_dry_run.py",
      "M scripts/benchmark_contract_metadata.py",
      "M scripts/build_execution_queue.py",
      "M scripts/scir_bootstrap_pipeline.py",
      "M scripts/validate_repo_contracts.py",
      "?? artifacts/benchmark_runs/python-proof-loop-full-20260407T155526Z/",
      "?? artifacts/benchmark_runs/python-proof-loop-full-20260407T155606Z/",
      "?? artifacts/benchmark_runs/python-proof-loop-full-20260407T155650Z/",
      "?? artifacts/benchmark_runs/python-proof-loop-full-20260407T155833Z/",
      "?? artifacts/benchmark_runs/python-proof-loop-full-20260407T164321Z/",
      "?? artifacts/sweeps/6b79ba2f2f78-20260407T155540Z/",
      "?? artifacts/sweeps/6b79ba2f2f78-20260407T155625Z/",
      "?? artifacts/sweeps/6b79ba2f2f78-20260407T155806Z/",
      "?? artifacts/sweeps/6b79ba2f2f78-20260407T164254Z/",
      "?? plans/2026-04-07-q-06-011-lock-track-c-provenance-note-overwrite-semantics.md",
      "?? plans/2026-04-07-q-06-012-checkpoint-integrity-and-governance-evidence-binding.md",
      "?? plans/2026-04-07-queue-closeout-and-validation-checkpoint.md",
      "?? reports/exports/checkpoint_closeout.export.json",
      "?? schemas/checkpoint_closeout.schema.json",
      "?? scripts/deferred_track_d.py"
    ]
  },
  "residual_risks": [
    "Later operators could still misread Q-06-011 as a standalone markdown closeout if the checkpoint artifact and decision export drift apart.",
    "Hand-edited queue or export surfaces could still drift unless queue/export validation remains part of the blocking checkpoint gate.",
    "A future operator could still try to resume work ad hoc unless the re-entry rules stay fail-closed and checkpoint evidence remains current."
  ],
  "reentry_conditions": [
    "roadmap selection is complete in an authoritative roadmap or active-plan source before the queue leaves EMPTY BY DESIGN",
    "a bounded next item is defined with queue ID, scope, touched surfaces, validation, and done evidence",
    "validator and export impact are assessed before any new item is marked ready",